<?xml version="1.0"?>
<!DOCTYPE dup5db SYSTEM "dup5-xml-db.dtd">
<dup5db>
  <head>
    <filename>$$FILENAME$$</filename>
    <format>$$FORMAT$$</format>
    <directory>$$DIRECTORY$$</directory>
    <dupver>$$DUPVER$$</dupver>
    <dupedit>$$DUPEDIT$$</dupedit>
    <dupurl>$$DUPURL$$</dupurl>
  </head>
  <entries>
